*****************************************************
Haploview 4.2	Java Version: 11.0.13
*****************************************************


Arguments:	-n	-info	pop1maf002.matrix.MajorAMinorT.info	-pedfile	pop1maf002.matrix.MajorAMinorT.ped	-maxdistance	30	-dprime	-minGeno	0.6	-minMAF	0	-hwcutoff	0	-log	pop1maf002.matrix.MajorAMinorT.log	


Max LD comparison distance = 30kb
Minimum MAF = 0.0
Minimum SNP genotype % = 0.6
Hardy Weinberg equilibrium p-value cutoff = 0.0
Using data file: pop1maf002.matrix.MajorAMinorT.ped
FastTree Version 2.1.10 Double precision (No SSE3)
Alignment: pop1_10000.fa
Nucleotide distances: Jukes-Cantor Joins: balanced Support: SH-like 1000
Search: Normal +NNI +SPR (2 rounds range 10) +ML-NNI opt-each=1
TopHits: 1.00*sqrtN close=default refresh=0.80
ML Model: Jukes-Cantor, CAT approximation with 20 rate categories
      0.77 seconds: Top hits for    142 of    497 seqs (at seed    100)
      1.02 seconds: Top hits for    215 of    497 seqs (at seed    200)
      1.43 seconds: Top hits for    339 of    497 seqs (at seed    300)
      1.71 seconds: Top hits for    415 of    497 seqs (at seed    400)
      2.00 seconds: Checking top hits for      1 of    497 seqs
Using marker information file: pop1maf002.matrix.MajorAMinorT.info
Writing output to pop1maf002.matrix.MajorAMinorT.ped.LD
      6.46 seconds: Joined    100 of    494
     10.61 seconds: Joined    200 of    494
     14.41 seconds: Joined    300 of    494
     17.56 seconds: Joined    400 of    494
Initial topology in 19.64 seconds
Refining topology: 36 rounds ME-NNIs, 2 rounds ME-SPRs, 18 rounds ML-NNIs
     19.64 seconds: ME NNI round 1 of 36, 1 of 495 splits
     19.88 seconds: ME NNI round 1 of 36, 101 of 495 splits, 2 changes (max delta 0.000)
     20.12 seconds: ME NNI round 1 of 36, 201 of 495 splits, 9 changes (max delta 0.000)
     20.36 seconds: ME NNI round 1 of 36, 301 of 495 splits, 20 changes (max delta 0.001)
     20.60 seconds: ME NNI round 1 of 36, 401 of 495 splits, 31 changes (max delta 0.001)
     20.80 seconds: ME NNI round 2 of 36, 1 of 495 splits
     21.01 seconds: ME NNI round 2 of 36, 101 of 495 splits, 0 changes
     21.22 seconds: ME NNI round 2 of 36, 201 of 495 splits, 0 changes
     21.43 seconds: ME NNI round 2 of 36, 301 of 495 splits, 1 changes (max delta 0.000)
     21.63 seconds: ME NNI round 2 of 36, 401 of 495 splits, 2 changes (max delta 0.000)
     21.83 seconds: ME NNI round 3 of 36, 1 of 495 splits
     22.05 seconds: ME NNI round 3 of 36, 101 of 495 splits, 0 changes
     25.93 seconds: SPR round   1 of   2, 101 of 992 nodes
     29.59 seconds: SPR round   1 of   2, 201 of 992 nodes
     33.60 seconds: SPR round   1 of   2, 301 of 992 nodes
     37.15 seconds: SPR round   1 of   2, 401 of 992 nodes
     40.68 seconds: SPR round   1 of   2, 501 of 992 nodes
     44.77 seconds: SPR round   1 of   2, 601 of 992 nodes
     48.09 seconds: SPR round   1 of   2, 701 of 992 nodes
     51.59 seconds: SPR round   1 of   2, 801 of 992 nodes
     55.34 seconds: SPR round   1 of   2, 901 of 992 nodes
     58.46 seconds: ME NNI round 13 of 36, 1 of 495 splits
     58.68 seconds: ME NNI round 13 of 36, 101 of 495 splits, 0 changes
     58.90 seconds: ME NNI round 13 of 36, 201 of 495 splits, 0 changes
     59.11 seconds: ME NNI round 13 of 36, 301 of 495 splits, 0 changes
     59.33 seconds: ME NNI round 13 of 36, 401 of 495 splits, 0 changes
     59.53 seconds: SPR round   2 of   2, 1 of 992 nodes
     63.38 seconds: SPR round   2 of   2, 101 of 992 nodes
     67.04 seconds: SPR round   2 of   2, 201 of 992 nodes
     71.04 seconds: SPR round   2 of   2, 301 of 992 nodes
     74.57 seconds: SPR round   2 of   2, 401 of 992 nodes
     78.09 seconds: SPR round   2 of   2, 501 of 992 nodes
     82.16 seconds: SPR round   2 of   2, 601 of 992 nodes
     85.47 seconds: SPR round   2 of   2, 701 of 992 nodes
     88.96 seconds: SPR round   2 of   2, 801 of 992 nodes
     92.65 seconds: SPR round   2 of   2, 901 of 992 nodes
     95.75 seconds: ME NNI round 25 of 36, 1 of 495 splits
     95.97 seconds: ME NNI round 25 of 36, 101 of 495 splits, 0 changes
     96.19 seconds: ME NNI round 25 of 36, 201 of 495 splits, 0 changes
     96.40 seconds: ME NNI round 25 of 36, 301 of 495 splits, 0 changes
     96.62 seconds: ME NNI round 25 of 36, 401 of 495 splits, 0 changes
Total branch-length 0.999 after 98.20 sec
     98.32 seconds: ML Lengths 1 of 495 splits
     99.68 seconds: ML Lengths 101 of 495 splits
    101.01 seconds: ML Lengths 201 of 495 splits
    102.37 seconds: ML Lengths 301 of 495 splits
    103.71 seconds: ML Lengths 401 of 495 splits
    105.01 seconds: ML NNI round 1 of 18, 1 of 495 splits
    110.65 seconds: ML NNI round 1 of 18, 101 of 495 splits, 5 changes (max delta 0.000)
    116.30 seconds: ML NNI round 1 of 18, 201 of 495 splits, 7 changes (max delta 0.000)
    121.92 seconds: ML NNI round 1 of 18, 301 of 495 splits, 11 changes (max delta 0.000)
    127.47 seconds: ML NNI round 1 of 18, 401 of 495 splits, 17 changes (max delta 0.000)
ML-NNI round 1: LogLk = -279175.602 NNIs 23 max delta 1.17 Time 132.90
    133.20 seconds: Site likelihoods with rate category 1 of 20
    133.51 seconds: Site likelihoods with rate category 2 of 20
    133.81 seconds: Site likelihoods with rate category 3 of 20
    134.12 seconds: Site likelihoods with rate category 4 of 20
    134.42 seconds: Site likelihoods with rate category 5 of 20
    134.72 seconds: Site likelihoods with rate category 6 of 20
    135.03 seconds: Site likelihoods with rate category 7 of 20
    135.33 seconds: Site likelihoods with rate category 8 of 20
    135.63 seconds: Site likelihoods with rate category 9 of 20
    135.94 seconds: Site likelihoods with rate category 10 of 20
    136.24 seconds: Site likelihoods with rate category 11 of 20
    136.54 seconds: Site likelihoods with rate category 12 of 20
    136.84 seconds: Site likelihoods with rate category 13 of 20
    137.15 seconds: Site likelihoods with rate category 14 of 20
    137.45 seconds: Site likelihoods with rate category 15 of 20
    137.75 seconds: Site likelihoods with rate category 16 of 20
    138.06 seconds: Site likelihoods with rate category 17 of 20
    138.36 seconds: Site likelihoods with rate category 18 of 20
    138.66 seconds: Site likelihoods with rate category 19 of 20
    138.97 seconds: Site likelihoods with rate category 20 of 20
Switched to using 20 rate categories (CAT approximation)
Rate categories were divided by 0.819 so that average rate = 1.0
CAT-based log-likelihoods may not be comparable across runs
Use -gamma for approximate but comparable Gamma(20) log-likelihoods
    139.36 seconds: ML NNI round 2 of 18, 1 of 495 splits
    140.65 seconds: ML NNI round 2 of 18, 101 of 495 splits, 3 changes (max delta 0.000)
    143.04 seconds: ML NNI round 2 of 18, 301 of 495 splits, 9 changes (max delta 0.000)
    144.35 seconds: ML NNI round 2 of 18, 401 of 495 splits, 11 changes (max delta 0.000)
ML-NNI round 2: LogLk = -274490.865 NNIs 15 max delta 1.54 Time 145.64
    145.64 seconds: ML NNI round 3 of 18, 1 of 495 splits
ML-NNI round 3: LogLk = -274490.864 NNIs 0 max delta 0.00 Time 146.53
Turning off heuristics for final round of ML NNIs (converged)
    146.53 seconds: ML NNI round 4 of 18, 1 of 495 splits
    152.02 seconds: ML NNI round 4 of 18, 101 of 495 splits, 0 changes
    157.62 seconds: ML NNI round 4 of 18, 201 of 495 splits, 0 changes
    163.17 seconds: ML NNI round 4 of 18, 301 of 495 splits, 0 changes
    168.64 seconds: ML NNI round 4 of 18, 401 of 495 splits, 0 changes
ML-NNI round 4: LogLk = -274490.861 NNIs 0 max delta 0.00 Time 173.96 (final)
    173.96 seconds: ML Lengths 1 of 495 splits
    175.25 seconds: ML Lengths 101 of 495 splits
    176.54 seconds: ML Lengths 201 of 495 splits
    177.83 seconds: ML Lengths 301 of 495 splits
    179.10 seconds: ML Lengths 401 of 495 splits
Optimize all lengths: LogLk = -274490.861 Time 180.46
    192.15 seconds: ML split tests for    100 of    494 internal splits
    203.30 seconds: ML split tests for    200 of    494 internal splits
    214.39 seconds: ML split tests for    300 of    494 internal splits
    225.54 seconds: ML split tests for    400 of    494 internal splits
Total time: 236.46 seconds Unique: 497/500 Bad splits: 0/494
